{
  "schema_version": 1,
  "id": "constraints.add_subsuming_candidate",
  "family": "templates_constraints",
  "description": "A new constraint that subsumes the old named concept changes constrained-template partial ordering.",
  "language_rules": ["temp.constr.normal", "temp.constr.order", "temp.func.order"],
  "mutation": "Add a FourByte concept and a more constrained pointer overload.",
  "primary_module": "Provider",
  "tracked_modules": ["Provider"],
  "observation": { "kind": "selected_declaration", "probe_id": "result" },
  "states": {
    "before": { "modules": [{ "name": "Provider", "source": "before/provider.cppm", "imports": [] }], "consumer": "before/consumer.cpp" },
    "after": { "modules": [{ "name": "Provider", "source": "after/provider.cppm", "imports": [] }], "consumer": "after/consumer.cpp" }
  }
}

