{
  "schema_version": 1,
  "id": "conversion.add_better_conversion_function",
  "family": "adl_conversions",
  "description": "A new conversion function provides a better second standard conversion sequence.",
  "language_rules": ["over.match.conv", "over.best.ics"],
  "mutation": "Add conversion operator long alongside operator int.",
  "primary_module": "Provider",
  "tracked_modules": ["Provider"],
  "observation": { "kind": "selected_declaration", "probe_id": "result" },
  "states": {
    "before": { "modules": [{ "name": "Provider", "source": "before/provider.cppm", "imports": [] }], "consumer": "before/consumer.cpp" },
    "after": { "modules": [{ "name": "Provider", "source": "after/provider.cppm", "imports": [] }], "consumer": "after/consumer.cpp" }
  }
}
