{
  "schema_version": 1,
  "id": "adl.add_associated_namespace_function",
  "family": "adl_conversions",
  "description": "A new non-template ADL candidate replaces the previously selected ordinary generic function.",
  "language_rules": ["basic.lookup.argdep", "over.match.best.general"],
  "mutation": "Add a function to the argument type's associated namespace.",
  "primary_module": "Provider",
  "tracked_modules": ["Provider"],
  "observation": { "kind": "selected_declaration", "probe_id": "result" },
  "states": {
    "before": { "modules": [{ "name": "Provider", "source": "before/provider.cppm", "imports": [] }], "consumer": "before/consumer.cpp" },
    "after": { "modules": [{ "name": "Provider", "source": "after/provider.cppm", "imports": [] }], "consumer": "after/consumer.cpp" }
  }
}
