{
  "schema_version": 1,
  "id": "lookup.export_using_changes_overload_set",
  "family": "lookup_overload",
  "description": "A new declaration before an exported using-declaration enlarges the visible overload set.",
  "language_rules": ["namespace.udecl", "basic.lookup.argdep", "over.match"],
  "mutation": "Add a better overload to the target namespace before an exported using-declaration.",
  "primary_module": "Provider",
  "tracked_modules": ["Provider"],
  "observation": { "kind": "selected_declaration", "probe_id": "result" },
  "states": {
    "before": { "modules": [{ "name": "Provider", "source": "before/provider.cppm", "imports": [] }], "consumer": "before/consumer.cpp" },
    "after": { "modules": [{ "name": "Provider", "source": "after/provider.cppm", "imports": [] }], "consumer": "after/consumer.cpp" }
  }
}

