{
  "schema_version": 1,
  "id": "controls.unused_noninline_body",
  "family": "direct_and_controls",
  "description": "Changing a non-exported helper body does not affect the consumer outcome.",
  "language_rules": ["module.interface", "basic.def.odr"],
  "mutation": "Change the body of a non-exported and unused non-inline helper.",
  "primary_module": "Provider",
  "tracked_modules": ["Provider"],
  "observation": { "kind": "selected_declaration", "probe_id": "result" },
  "states": {
    "before": { "modules": [{ "name": "Provider", "source": "before/provider.cppm", "imports": [] }], "consumer": "before/consumer.cpp" },
    "after": { "modules": [{ "name": "Provider", "source": "after/provider.cppm", "imports": [] }], "consumer": "after/consumer.cpp" }
  }
}

