{
  "schema_version": 1,
  "id": "constraints.add_requires_expression_candidate",
  "family": "templates_constraints",
  "description": "A newly added requires-expression overload is viable for an unchanged type and supersedes the generic template.",
  "language_rules": ["expr.prim.req", "temp.constr.order", "over.match.best.general"],
  "mutation": "Add a constrained overload requiring an encode member.",
  "primary_module": "Provider",
  "tracked_modules": ["Provider"],
  "observation": { "kind": "selected_declaration", "probe_id": "result" },
  "states": {
    "before": { "modules": [{ "name": "Provider", "source": "before/provider.cppm", "imports": [] }], "consumer": "before/consumer.cpp" },
    "after": { "modules": [{ "name": "Provider", "source": "after/provider.cppm", "imports": [] }], "consumer": "after/consumer.cpp" }
  }
}

