{
  "schema_version": 1,
  "id": "overload.add_non_template_candidate",
  "family": "lookup_overload",
  "description": "A non-template overload is preferred over the previously selected function template specialization.",
  "language_rules": ["over.match.best.general", "temp.over"],
  "mutation": "Add a non-template exact-match overload alongside an unchanged generic template.",
  "primary_module": "Provider",
  "tracked_modules": ["Provider"],
  "observation": { "kind": "selected_declaration", "probe_id": "result" },
  "states": {
    "before": { "modules": [{ "name": "Provider", "source": "before/provider.cppm", "imports": [] }], "consumer": "before/consumer.cpp" },
    "after": { "modules": [{ "name": "Provider", "source": "after/provider.cppm", "imports": [] }], "consumer": "after/consumer.cpp" }
  }
}

